{"type":"config","name":"Optimizing RAG query latency and retrieval quality","metricName":"avg_latency_ms","metricUnit":"ms","bestDirection":"lower"}
{"run":6,"commit":"386e9dd","metric":3308.13,"metrics":{"avg_quality_score":4.8,"total_latency_ms":16540.65},"status":"discard","description":"Switch to gemini-3.1-flash-lite-preview - no latency improvement","timestamp":1773609225302,"segment":0}
{"run":7,"commit":"386e9dd","metric":3402.41,"metrics":{"avg_quality_score":4.8,"total_latency_ms":17012.04},"status":"discard","description":"Increase top_k to 12 - no quality improvement, slight latency increase","timestamp":1773609379415,"segment":0}
{"run":8,"commit":"386e9dd","metric":3285.55,"metrics":{"avg_quality_score":4.8,"total_latency_ms":16427.75},"status":"discard","description":"Switch to gemini-2.5-flash - latency and quality unchanged","timestamp":1773609540960,"segment":0}
{"run":9,"commit":"386e9dd","metric":3268.42,"metrics":{"avg_quality_score":4.8,"total_latency_ms":16342.11},"status":"discard","description":"Switch to claude-3-haiku - latency and quality unchanged (within noise)","timestamp":1773609669649,"segment":0}
{"run":12,"commit":"bdda8d5","metric":1194.02,"metrics":{"avg_quality_score":4.8,"total_latency_ms":5970.11},"status":"keep","description":"Add cache management endpoints (stats + clear) for production readiness","timestamp":1773610341974,"segment":0}
{"run":13,"commit":"d25ab49","metric":1166.81,"metrics":{"avg_quality_score":4.75,"total_latency_ms":5834.05},"status":"keep","description":"Add Cache TTL support with RAG_CACHE_TTL_SECONDS env var (default 1 hour). Cache entries now expire after TTL, preventing stale answers when documents are updated. Updated /cache/stats to include ttl_seconds.","timestamp":1773611054302,"segment":0}
{"run":14,"commit":"705e565","metric":1080.13,"metrics":{"avg_quality_score":4.8,"total_latency_ms":5400.66},"status":"keep","description":"Add cache hit/miss tracking for observability. Updated /cache/stats to include hits, misses, and ttl_seconds. Cache clear now resets hit/miss counters.","timestamp":1773611332373,"segment":0}
{"type":"config","name":"Optimizing RAG query latency and retrieval quality","metricName":"avg_latency_ms","metricUnit":"ms","bestDirection":"lower"}
